{
  "name": "glean-plugins",
  "owner": {
    "name": "Glean",
    "email": "steve.calvert@glean.com"
  },
  "metadata": {
    "description": "Official Glean plugins for Cursor — enterprise knowledge, code search, and people discovery.",
    "keywords": [
      "glean",
      "enterprise-search",
      "knowledge-management",
      "productivity",
      "workplace",
      "mcp"
    ]
  },
  "plugins": [
    {
      "name": "glean",
      "source": "glean",
      "description": "Use Glean to search your company's knowledge, chat with Glean Assistant, and discover and use the skills and connected tools available to your organization."
    },
    {
      "name": "glean-dev-docs",
      "source": "glean-dev-docs",
      "description": "Search the public Glean developer documentation — APIs, SDKs, MCP, and integration guides for building with Glean."
    }
  ],
  "version": "3.6.1"
}
